{
  "$schema": "https://json-schema.org/draft/2020-12/schema",
  "$id": "item.schema.json",
  "title": "Item",
  "type": "object",
  "properties": {
    "id": { "type": ["string", "null"] },
    "name": { "type": ["string", "null"] },
    "type": { "type": ["string", "null"] },
    "effects": {
      "type": ["array", "null"],
      "items": { "type": "string" }
    },
    "source": { "type": ["string", "null"] },
    "summary": { "type": ["string", "null"] },
    "image": { "type": ["string", "null"] },
    "source_url": { "type": ["string", "null"], "format": "uri" }
  },
  "required": ["id", "name", "type", "effects", "source", "summary", "image", "source_url"],
  "additionalProperties": false
}
